feed_id,community_id,source,source_type,category,pipeline_type,agency_name,geographic_reference,impact_level,active,sort_order,target_table,filter_expr,dedupe_on,status_notes
wake-county-nc-candidate,00000000-0000-4000-8000-000000000099,https://wake.granicus.com/ViewPublisherRSS.php?view_id=18&mode=agendas,rss,County Commission & county business,government_notice,Wake County Board of Commissioners,"Wake County, NC",medium,false,0,meetings,,guid|link,Phase 1A contract fixture — Granicus RSS
be-public-notices,d67c558f-1f04-4811-a565-873ae2afd6f3,https://www.utah.gov/pmn/sitemap/publicbody/2637.html,html,County Commission & county business,government_notice,Box Elder County Commission,"Box Elder County, UT",medium,true,10,alerts,publicbody/2637,guid|link,PMN county commissioners notices → alerts
be-county-commission-agenda,d67c558f-1f04-4811-a565-873ae2afd6f3,https://www.utah.gov/pmn/sitemap/publicbody/2637.html,html,County Commission & county business,government_notice,Box Elder County Commission,"Box Elder County, UT",medium,true,20,meetings,publicbody/2637,guid|link,PMN county commissioners agendas → meetings
be-stratos-alias-news,d67c558f-1f04-4811-a565-873ae2afd6f3,"Box Elder County UT ""Stratos"" OR ""data center""",keyword,News,news,Box Elder County,"Box Elder County, UT",low,false,30,alerts,,url,Google News keyword alias watch
tremonton-city-meetings,d67c558f-1f04-4811-a565-873ae2afd6f3,https://www.tremontoncity.org/events/feed/,rss,City government (Tremonton),government_notice,Tremonton City Council,"Tremonton, UT",medium,true,40,meetings,,guid|link,Tremonton /events/feed/ → meetings
be-emergency-email,d67c558f-1f04-4811-a565-873ae2afd6f3,alerts@boxeldercounty.gov,email,Emergency alerts,government_notice,Box Elder County Emergency Services,"Box Elder County, UT",high,false,50,alerts,,message-id,Emergency notification mailbox (inactive)
